{
  "metadata": {
    "name": "add_zero",
    "kind": "THEOREM"
  },
  "target_formalization": {
    "claim": "for every natural number n, n plus zero equals n",
    "hypotheses": [
      {
        "name": "hn",
        "text": "n is a natural number"
      }
    ],
    "formal_statement": "theorem wit_add_zero (n : Nat) : n + 0 = n"
  },
  "target_protection": {
    "statement_tampering_forbidden": true,
    "frozen_target_sha256": "a664ce37dc7b0dbc20d7dc71b58c2201674fdb50770ee74c29faff6b9e19b167",
    "original_statement": "for every natural number n, n plus zero equals n",
    "authorized_mutations": []
  },
  "external_dependencies": [
    {
      "theorem_name": "Nat.add_zero"
    }
  ],
  "lemma_plan": [
    {
      "step_id": "1",
      "type": "HAVE",
      "statement": "n plus zero equals n by the definition of addition",
      "cites": [
        "Nat.add_zero"
      ],
      "method": "rewriting with the cited identity",
      "formalization": {
        "type": "n + 0 = n",
        "tactic": "simp"
      }
    },
    {
      "step_id": "2",
      "type": "SHOW",
      "statement": "for every natural number n, n plus zero equals n",
      "depends_on": [
        "1"
      ],
      "method": "generalization over n",
      "formalization": {
        "type": "n + 0 = n",
        "tactic": "exact step1"
      }
    }
  ],
  "generator_directive": {
    "status_to_assert": "UNVERIFIED"
  }
}
