{
  "metadata": {
    "name": "drift",
    "kind": "THEOREM"
  },
  "target_formalization": {
    "claim": "a claim whose rendered statement differs from the frozen target",
    "hypotheses": []
  },
  "target_protection": {
    "statement_tampering_forbidden": true,
    "frozen_target_sha256": "0000000000000000000000000000000000000000000000000000000000000000",
    "original_statement": "a claim whose rendered statement differs from the frozen target",
    "authorized_mutations": []
  },
  "external_dependencies": [],
  "lemma_plan": [
    {
      "step_id": "1",
      "type": "SHOW",
      "statement": "a claim whose rendered statement differs from the frozen target",
      "method": "assertion"
    }
  ],
  "generator_directive": {
    "status_to_assert": "UNVERIFIED"
  }
}
