{
  "metadata": {
    "name": "sum_odds",
    "kind": "THEOREM"
  },
  "target_formalization": {
    "claim": "the sum of the first n odd numbers equals n squared, for every natural number n",
    "hypotheses": [
      {
        "name": "hn",
        "text": "n is a natural number"
      }
    ],
    "preamble": "import Mathlib",
    "formal_statement": "theorem wit_sum_odds (n : ℕ) : ∑ i ∈ Finset.range n, (2 * i + 1) = n ^ 2"
  },
  "target_protection": {
    "statement_tampering_forbidden": true,
    "frozen_target_sha256": "11a2c51b3a0cd6174eb21cc973a54af4e84bcf58161407eb098a8a6eb669900c",
    "original_statement": "the sum of the first n odd numbers equals n squared, for every natural number n",
    "authorized_mutations": []
  },
  "external_dependencies": [
    {
      "theorem_name": "Finset.sum_range_succ"
    }
  ],
  "lemma_plan": [
    {
      "step_id": "1",
      "type": "HAVE",
      "statement": "the empty sum equals zero squared, which is the base case",
      "method": "evaluating both sides at zero",
      "formalization": {
        "type": "∑ i ∈ Finset.range 0, (2 * i + 1) = 0 ^ 2",
        "tactic": "simp"
      }
    },
    {
      "step_id": "2",
      "type": "HAVE",
      "statement": "if the identity holds at k then it holds at k plus one",
      "cites": [
        "Finset.sum_range_succ"
      ],
      "method": "peeling the last term off the sum and using the hypothesis",
      "formalization": {
        "type": "∀ k : ℕ, (∑ i ∈ Finset.range k, (2 * i + 1) = k ^ 2) → ∑ i ∈ Finset.range (k + 1), (2 * i + 1) = (k + 1) ^ 2",
        "tactic": "intro k ih\nrw [Finset.sum_range_succ, ih]\nring"
      }
    },
    {
      "step_id": "3",
      "type": "SHOW",
      "statement": "the sum of the first n odd numbers equals n squared, for every natural number n",
      "depends_on": [
        "1",
        "2"
      ],
      "method": "induction on n, discharging both cases above",
      "formalization": {
        "type": "∑ i ∈ Finset.range n, (2 * i + 1) = n ^ 2",
        "tactic": "induction n with\n| zero => exact step1\n| succ k ih => exact step2 k ih"
      }
    }
  ],
  "generator_directive": {
    "status_to_assert": "UNVERIFIED"
  }
}
