{
  "metadata": {
    "name": "forward",
    "kind": "THEOREM"
  },
  "target_formalization": {
    "claim": "a claim whose plan refers to a step that has not happened yet",
    "hypotheses": []
  },
  "target_protection": {
    "statement_tampering_forbidden": true,
    "frozen_target_sha256": "abcadcb90f46fe3e62e02391113e4e76f6e199fa82dd2146bb187d3b3e8ff3e4",
    "original_statement": "a claim whose plan refers to a step that has not happened yet",
    "authorized_mutations": []
  },
  "external_dependencies": [],
  "lemma_plan": [
    {
      "step_id": "1",
      "type": "HAVE",
      "statement": "something that leans on a later step",
      "depends_on": [
        "2"
      ],
      "method": "citing the future"
    },
    {
      "step_id": "2",
      "type": "SHOW",
      "statement": "a claim whose plan refers to a step that has not happened yet",
      "method": "the conclusion"
    }
  ],
  "generator_directive": {
    "status_to_assert": "UNVERIFIED"
  }
}
