{
  "metadata": {
    "name": "undeclared",
    "kind": "THEOREM"
  },
  "target_formalization": {
    "claim": "a claim whose plan cites a result it never declared",
    "hypotheses": []
  },
  "target_protection": {
    "statement_tampering_forbidden": true,
    "frozen_target_sha256": "1246d90030f90ceefabb5d45c4294fdf71d145f3487c39d7631fdf84308ac950",
    "original_statement": "a claim whose plan cites a result it never declared",
    "authorized_mutations": []
  },
  "external_dependencies": [
    {
      "theorem_name": "Nat.add_zero"
    }
  ],
  "lemma_plan": [
    {
      "step_id": "1",
      "type": "HAVE",
      "statement": "a step resting on an undeclared result",
      "cites": [
        "Nat.some_lemma_nobody_declared"
      ],
      "method": "citation"
    },
    {
      "step_id": "2",
      "type": "SHOW",
      "statement": "a claim whose plan cites a result it never declared",
      "depends_on": [
        "1"
      ],
      "method": "the conclusion"
    }
  ],
  "generator_directive": {
    "status_to_assert": "UNVERIFIED"
  }
}
