{
  "metadata": {
    "name": "add_comm",
    "kind": "THEOREM"
  },
  "target_formalization": {
    "claim": "addition of natural numbers is commutative",
    "hypotheses": [
      {
        "name": "hn",
        "text": "a and b are natural numbers"
      }
    ],
    "formal_statement": "theorem wit_add_comm (a b : Nat) : a + b = b + a"
  },
  "target_protection": {
    "statement_tampering_forbidden": true,
    "frozen_target_sha256": "fd0c08355e28a801edafd26cb38e60696db3136b528c8b470c4d7bb37bb56d0d",
    "original_statement": "addition of natural numbers is commutative",
    "authorized_mutations": []
  },
  "external_dependencies": [
    {
      "theorem_name": "Nat.add_comm"
    }
  ],
  "lemma_plan": [
    {
      "step_id": "1",
      "type": "HAVE",
      "statement": "a plus b equals b plus a",
      "cites": [
        "Nat.add_comm"
      ],
      "method": "the cited commutativity law",
      "formalization": {
        "type": "a + b = b + a",
        "tactic": "exact Nat.add_comm a b"
      }
    },
    {
      "step_id": "2",
      "type": "SHOW",
      "statement": "addition of natural numbers is commutative",
      "depends_on": [
        "1"
      ],
      "method": "generalization over both variables",
      "formalization": {
        "type": "a + b = b + a",
        "tactic": "exact step1"
      }
    }
  ],
  "generator_directive": {
    "status_to_assert": "UNVERIFIED"
  }
}
