{
  "metadata": {
    "name": "with_gap",
    "kind": "THEOREM"
  },
  "target_formalization": {
    "claim": "the stated arithmetic identity holds for every natural number",
    "hypotheses": [
      {
        "name": "hn",
        "text": "n is a natural number"
      }
    ],
    "formal_statement": "theorem wit_with_gap (n : Nat) : n + 0 = n"
  },
  "target_protection": {
    "statement_tampering_forbidden": true,
    "frozen_target_sha256": "ce9ac3c1f2e01c72223f9f1ff7a0502c2c8ba28e37380634e980b45f7fae9ba9",
    "original_statement": "the stated arithmetic identity holds for every natural number",
    "authorized_mutations": []
  },
  "external_dependencies": [
    {
      "theorem_name": "Nat.add_zero"
    }
  ],
  "lemma_plan": [
    {
      "step_id": "1",
      "type": "HAVE",
      "statement": "n plus zero equals n",
      "cites": [
        "Nat.add_zero"
      ],
      "method": "the cited identity",
      "formalization": {
        "type": "n + 0 = n",
        "tactic": "simp"
      }
    },
    {
      "step_id": "2",
      "type": "GAP",
      "statement": "the remaining case is not yet argued",
      "expecting": "an argument for the successor case"
    },
    {
      "step_id": "3",
      "type": "SHOW",
      "statement": "the stated arithmetic identity holds for every natural number",
      "depends_on": [
        "1"
      ],
      "method": "pending the gap above"
    }
  ],
  "generator_directive": {
    "status_to_assert": "UNVERIFIED"
  }
}
